username;date;retweets;favorites;text;geo;mentions;hashtags;id;permalink
DominicTV;2014-12-05 05:27;0;0;"Garner Decision: Thousands Protest Rally In Lower Manhattan: Thousands protested last night. This was just one... http:// bit.ly/12GMjfr";;;;"540859977770860544";https://twitter.com/DominicTV/status/540859977770860544
NewYorkCP;2014-12-05 05:23;0;0;"223 Arrested on Second Day of Garner Protests: NYPD: Police say 223 demonstrators were arrested Thursday night as… http:// dlvr.it/7kghwv";;;;"540858904041623554";https://twitter.com/NewYorkCP/status/540858904041623554
briggsjimmie;2014-12-05 05:05;1;1;"Second round: N.Y. demonstrators paralyze streets over Garner case #icantbreathe . http:// yahoonewsdigest-us.tumblr.com/104401738174";;;#icantbreathe;"540854527361294336";https://twitter.com/briggsjimmie/status/540854527361294336
MindyRosier;2014-12-05 05:04;0;1;"Rabbi Jill Jacobs, Randi Weingarten arrested at Garner protest http://www. jta.org/2014/12/04/new s-opinion/united-states/rabbi-jill-jacobs-randi-weingarten-arrested-at-garner-protest#.VIGs9WEkyiM.twitter …";;;#;"540854281747062784";https://twitter.com/MindyRosier/status/540854281747062784
DaniDur;2014-12-05 04:38;0;0;"Eric Garner case . People protest about the Gran Jury decision @Brooklyn Bridge http:// instagram.com/p/wOa7I4J5Ms/";;@Brooklyn;;"540847701420965888";https://twitter.com/DaniDur/status/540847701420965888
josemanuelRD_;2014-12-05 04:30;0;0;"Die-in at Times Square: group of protestor laying on the ground for memory of Eric Garner http:// cnn.it/1vvmPwo";;;;"540845668089073664";https://twitter.com/josemanuelRD_/status/540845668089073664
RonEClaiborne;2014-12-05 01:29;1;5;"Demonstrators marching up Broadway in Manhattan protesting grand jury decision in Eric Garner death pic.twitter.com/bZfe8LYk74";;;;"540800178543136768";https://twitter.com/RonEClaiborne/status/540800178543136768
chhubbster;2014-12-04 23:42;0;0;"Hanging out with my old friend Nadra after the Eric Garner protest march in Harlem. @Harlem State… http:// instagram.com/p/wN5B6aDga4/";;@Harlem;;"540773167896465408";https://twitter.com/chhubbster/status/540773167896465408
LEXercise;2014-12-04 22:30;0;1;"RT @GlobalGrind Ramsey Orta the man who filmed Eric Garner 's chokehold death has been indicted http:// bit.ly/1w4ajWy pic.twitter.com/jrT6H8pJgm";;@GlobalGrind;;"540755133148430336";https://twitter.com/LEXercise/status/540755133148430336
amandamaratta;2014-12-04 22:29;0;0;"Eric Garner , Michael Brown: shut it down, shut it down. @Lincoln Tunnel http:// instagram.com/p/wNwpDbksLP/";;@Lincoln;;"540754720978386944";https://twitter.com/amandamaratta/status/540754720978386944
ErnLaden;2014-12-04 22:11;0;0;"New Yorkers protesting against the Eric Garner decision. No justice, No peace @Ermenegildo Zegna Corp http:// instagram.com/p/wNun5bNJhK/";;@Ermenegildo;;"540750285417611264";https://twitter.com/ErnLaden/status/540750285417611264
ErnLaden;2014-12-04 22:05;0;0;"Protest for Eric Garner on 53rd and 5th. No justice, no peace! @Ermenegildo Zegna Corp http:// instagram.com/p/wNt5EytJuN/";;@Ermenegildo;;"540748674327130113";https://twitter.com/ErnLaden/status/540748674327130113
dNo718;2014-12-04 22:01;0;0;"@deray you are my fuckin hero. I wrote a song for eric garner and all proceeds go to his family. https:// andrewpaladino.bandcamp.com/track/song-for -eric-garner …";;@deray;;"540747696014127104";https://twitter.com/dNo718/status/540747696014127104
NewYorkCP;2014-12-04 21:57;1;0;"Protesters interfere with man’s search to find suicidal son: The Eric Garner protesters are not only stopping… http:// dlvr.it/7kTQF8";;;;"540746663371870208";https://twitter.com/NewYorkCP/status/540746663371870208
culcannon;2014-12-04 21:37;0;1;"@BrookeBCNN Watching you live right now, thanks for your reporting on Eric Garner NYC protests #nycprotest #EricGarner";;@BrookeBCNN;#nycprotest #EricGarner;"540741764983050241";https://twitter.com/culcannon/status/540741764983050241
RonColeman;2014-12-04 21:28;4;2;"MT @audreykubetin : Art as protest: #Garner projection in Mt Pleasant DC pic.twitter.com/iXK1zBNXNp | Art as publicity stunt. Um, stunt as "art"";;@audreykubetin;#Garner;"540739567612358656";https://twitter.com/RonColeman/status/540739567612358656
ImSaucinOnBru;2014-12-04 21:11;5;8;"My heart really goes out to Eric garner 's family; 6 kids got left and the last words they'll ever hear their dad say is I can't breathe";;;;"540735284997267456";https://twitter.com/ImSaucinOnBru/status/540735284997267456
joshuetree;2014-12-04 21:06;0;0;"@hi_im_shan here's the thing - if you don't do things that garner attention - there is no point.";;@hi_im_shan;;"540733869293830144";https://twitter.com/joshuetree/status/540733869293830144
KarinAraneta;2014-12-04 21:00;0;0;"Justice for Eric Garner . A protest at the 96th St. station earlier tonight. @MTA Subway - 96th St… http:// instagram.com/p/wNmdVvE1h2/";;@MTA;;"540732328063279104";https://twitter.com/KarinAraneta/status/540732328063279104
pettyintrigues;2014-12-04 20:52;0;0;"@KaylaEpstein Ah--94/C'bus here. Thought all the sirens were Garner -related.";;@KaylaEpstein;;"540730452265693184";https://twitter.com/pettyintrigues/status/540730452265693184
NewYorkCP;2014-12-04 20:38;0;0;"NY1 Online: Bratton Talks Garner Protest Plans, Efforts to Reform Department: Errol Louis spoke with Police… http:// dlvr.it/7kS89m";;;;"540726779443306496";https://twitter.com/NewYorkCP/status/540726779443306496
NewYorkCP;2014-12-04 20:38;0;0;"Civil Rights Leaders Plan March on Washington in Wake of Garner , Brown Decisions: In the wake of decisions by grand… http:// dlvr.it/7kSGqC";;;;"540726774506606593";https://twitter.com/NewYorkCP/status/540726774506606593
hattiehathaway;2014-12-04 20:35;1;2;"Protesters Swarm NYC Over Eric Garner Death For Second Night http://www. huffingtonpost.com/2014/12/04/pro testers-nyc-chokehold_n_6273174.html … #BlackLivesMatter #EricGardner #ItStopsToday";;;#BlackLivesMatter #EricGardner #ItStopsToday;"540726231680180224";https://twitter.com/hattiehathaway/status/540726231680180224
mauricioswg;2014-12-04 20:34;1;2;"My favorite restaurant shares its support for Eric Garner . As if I couldn't love this place even more.… http:// instagram.com/p/wNiproGYKH/";;;;"540725946308100096";https://twitter.com/mauricioswg/status/540725946308100096
NewYorkCP;2014-12-04 20:07;0;0;"Once More, Thousands of Garner Protesters Flood Manhattan: The protest tonight. (Photo: Will Bredderman)Several… http:// dlvr.it/7kRfh6";;;;"540719003418001408";https://twitter.com/NewYorkCP/status/540719003418001408
tree__leaf;2014-12-04 19:57;0;2;"Saw history before my eyes today, peaceful protesting through traffic on Madison Ave for the Garner … http:// instagram.com/p/wNfQYsJ5me/";;;;"540716490069409792";https://twitter.com/tree__leaf/status/540716490069409792
LuisaGoneWild;2014-12-04 19:54;0;0;"I CAN'T BREATHE! #Garner";;;#Garner;"540715892473331712";https://twitter.com/LuisaGoneWild/status/540715892473331712
herelenitweets;2014-12-04 19:51;0;0;"He died so his brothers could be free RT @haaretzcom : Jewish group joins N.Y. protest march on Eric Garner case http:// htz.li/10v";;@haaretzcom;;"540715040232714240";https://twitter.com/herelenitweets/status/540715040232714240
dontbehave;2014-12-04 19:49;0;2;"TV show Inside Edition from Eric Garner to Mariah Carey to Rockettes seems to trivialize things important and maximize the trivial";;;;"540714433077841922";https://twitter.com/dontbehave/status/540714433077841922
ConnorByrnes;2014-12-04 19:47;0;0;"ERIC GARNER ! MICHAEL BROWN! SHUT IT DOWN!! SHUT IT DOWN!! @West Side Highway http:// instagram.com/p/wNeIuMjLXT/";;@West;;"540714027559948288";https://twitter.com/ConnorByrnes/status/540714027559948288
TamikaDMallory;2014-12-04 19:42;3;2;"Real out here! #icantbreathelikerightnow #garner @TimesSquare http:// instagram.com/p/wNdjwmCx0E/";;@TimesSquare;#icantbreathelikerightnow #garner;"540712757910568960";https://twitter.com/TamikaDMallory/status/540712757910568960
MJStarLover;2014-12-04 19:41;2;4;"The streets of NYC is packed. Everyone is protesting in all the boroughs. All in honor of Eric Garner , and all the other black lives ended.";;;;"540712552326774784";https://twitter.com/MJStarLover/status/540712552326774784
HugoKijne;2014-12-04 19:38;0;0;"@seanhannity and Ann Coulter agree that Eric Garner was killed because liberals want to collect cigarette taxes #dumbanddumber";;@seanhannity;#dumbanddumber;"540711673968201728";https://twitter.com/HugoKijne/status/540711673968201728
malinism;2014-12-04 19:30;0;0;"My Twitter feed is a mix of Eric Garner and Peter Pan.";;;;"540709811428814849";https://twitter.com/malinism/status/540709811428814849
CWjusticenow;2014-12-04 19:23;0;0;"The Department of Transportation has shut down the Staten Island Ferry to prevent Eric Garner protesters from reaching Staten Island.";;;;"540708050081157120";https://twitter.com/CWjusticenow/status/540708050081157120
HugoKijne;2014-12-04 19:20;0;0;"Just heard @seanhannity interview Rand Paul. Hannity tried to find excuses for Garner 's killing throughout the interview.";;@seanhannity;;"540707266182516737";https://twitter.com/HugoKijne/status/540707266182516737
isaiahfish;2014-12-04 19:06;1;0;"11 times Eric Garner said "Icant breathe!" 11 minutes we sit in silence. @Macy's Herald Square http:// instagram.com/p/wNZdZvidwm/";;@Macy;;"540703743034265600";https://twitter.com/isaiahfish/status/540703743034265600
CamLaurente;2014-12-04 19:02;0;0;"Finals, Eric Garner and Mike Brown. Columbia seemed to be in a damp mood until these trees were Iit… http:// instagram.com/p/wNY9bywb0d/";;;;"540702777953882113";https://twitter.com/CamLaurente/status/540702777953882113
ShogunLunn;2014-12-04 19:02;0;0;"Protestors marching down 5th Ave at 42nd St (Bryant Park) right now demanding justice for Eric Garner #icantbreathe https://twitter.com/ShogunLunn/status/540700327369252864/photo/1 pic.twitter.com/KU5m9izkZ1";;;#icantbreathe;"540702724221067264";https://twitter.com/ShogunLunn/status/540702724221067264
MrMarinKnows;2014-12-04 18:59;0;0;"Eleven minute sit in for every time Brother Garner yelled "I Can't Breathe". #WeCantBreathe @Macy's… http:// instagram.com/p/wNYosDt9HQ/";;@Macy;#WeCantBreathe;"540701931652780032";https://twitter.com/MrMarinKnows/status/540701931652780032
MaryEmilyOHara;2014-12-04 18:56;1;0;"NYC Eric Garner protest takes over Broadway downtown #HandsUpDontShoot #ThisStopsToday @Little… http:// instagram.com/p/wNYSLwwccZ/";;@Little;#HandsUpDontShoot #ThisStopsToday;"540701158730629121";https://twitter.com/MaryEmilyOHara/status/540701158730629121
Jacquie228;2014-12-04 18:53;3;1;"Notice how they made sure that the Michael Brown & Eric Garner decisions were both issued around same time but AFTER the Nov elections?";;;;"540700371447209985";https://twitter.com/Jacquie228/status/540700371447209985
_intellexual;2014-12-04 18:52;1;1;""who's streets?, our streets" #NYC #Garner pic.twitter.com/Y2WcZTS1XT";;;#NYC #Garner;"540700231734927360";https://twitter.com/_intellexual/status/540700231734927360
DanDeSalvo;2014-12-04 18:33;0;2;"“ @stephiehun : My twitter feed is half Peter Pan and half people protesting the non-indictment is Eric Garner 's death.”both miscarriages";;@stephiehun;;"540695316098727937";https://twitter.com/DanDeSalvo/status/540695316098727937
briggsjimmie;2014-12-04 18:31;1;0;"Exclusive: Children of Eric Garner help spark national debate on race ##EricGarner . http:// yahoonewsdigest-us.tumblr.com/104356774724";;;# #EricGarner;"540695032123359233";https://twitter.com/briggsjimmie/status/540695032123359233
PaperMate26;2014-12-04 18:21;1;0;"@NICKIMINAJ did u know in the Eric garner video the guy was singing along to pills n potions";;@NICKIMINAJ;;"540692305473470466";https://twitter.com/PaperMate26/status/540692305473470466
AprilRabkin;2014-12-04 18:19;0;0;"Blocking traffic in Eric Garner protest #blacklivesmatter pic.twitter.com/p2sSVduEXj";;;#blacklivesmatter;"540691984709865472";https://twitter.com/AprilRabkin/status/540691984709865472
Fresh_Professor;2014-12-04 18:18;0;0;"“ @HuffingtonPost : NYPD chokehold cop is Eagle scout blameless in Eric Garner 's death, police union boss says http:// huff.to/1zriuJQ ” #wtf";;@HuffingtonPost;#wtf;"540691659202519041";https://twitter.com/Fresh_Professor/status/540691659202519041
NewYorkCP;2014-12-04 18:16;0;0;"NJ Youths Share Concerns Following Eric Garner Case: More than a dozen kids at Newark's Boys & Girls Club talk… http:// dlvr.it/7kQ4TD";;;;"540691052097572865";https://twitter.com/NewYorkCP/status/540691052097572865
aPERRYniceguy;2014-12-04 17:46;0;1;"These Eric garner protestors are a bunch of fucks";;;;"540683479504408576";https://twitter.com/aPERRYniceguy/status/540683479504408576
NewYorkCP;2014-12-04 17:44;0;0;"SI Community Gathers for Demonstration Near Where Eric Garner Died: Hundreds of protesters are taking to city… http:// dlvr.it/7kPdtk";;;;"540683110266839040";https://twitter.com/NewYorkCP/status/540683110266839040
dresacker;2014-12-04 17:37;0;0;"Street Signs continued: #Eric Garner . Intimidation tactics pic.twitter.com/7krjql8rfq";;;#Eric;"540681242724020226";https://twitter.com/dresacker/status/540681242724020226
evanmcmurry;2014-12-04 17:29;12;6;"Brass band for Eric Garner . #icantbreathe pic.twitter.com/RABGJwAeWA";;;#icantbreathe;"540679237200801792";https://twitter.com/evanmcmurry/status/540679237200801792
mikemanh;2014-12-04 17:25;2;0;"Army of police during the #garner protest #icantbreath #blacklivesmatter @Canal Street http:// instagram.com/p/wNN4cdR0o9/";;@Canal;#garner #icantbreath #blacklivesmatter;"540678284745261056";https://twitter.com/mikemanh/status/540678284745261056
PaulGlader;2014-12-04 17:24;0;0;"Riot police on Wall Street... Looks like a protest marching down Broadway re: police brutality and #Garner #headlock case";;;#Garner #headlock;"540678126754611200";https://twitter.com/PaulGlader/status/540678126754611200
YankeeMan1973;2014-12-04 17:18;0;1;"Great spot on @NBAonTNT by Barkley, @TheJetOnTNT & @SHAQ on Ferguson & Eric Garner ! No matter if u agree with them or not I respect them";;@NBAonTNT @TheJetOnTNT @SHAQ;;"540676624560435200";https://twitter.com/YankeeMan1973/status/540676624560435200
evanmcmurry;2014-12-04 17:16;1;2;"Brass band for Eric Garner . #icantbreathe pic.twitter.com/KTGBvXrmwy";;;#icantbreathe;"540676001681145856";https://twitter.com/evanmcmurry/status/540676001681145856
wefordham;2014-12-04 17:10;0;0;"Coming at you live from #fordhamtalks to engage in discussion about Eric Garner and Mike Brown. #BlackLivesMatter";;;#fordhamtalks #BlackLivesMatter;"540674583482097664";https://twitter.com/wefordham/status/540674583482097664
MaxAKCarr;2014-12-04 17:10;0;1;"Protest for Eric Garner #BlackLivesMatter #unite4justice @City Hall Park Manhattan NYC http:// instagram.com/p/wNKB2ILZTM/";;@City;#BlackLivesMatter #unite4justice;"540674576456617984";https://twitter.com/MaxAKCarr/status/540674576456617984
MaxAKCarr;2014-12-04 17:10;0;0;"Second night of protests over Grand Jury's Eric Garner decision stopped traffic on Broadway. @City… http:// instagram.com/p/wNJ0dxLZRz/";;@City;;"540674527823683585";https://twitter.com/MaxAKCarr/status/540674527823683585
omneyaghanem;2014-12-04 17:04;0;0;"More than three blocks worth of lower Manhattan shut down for Eric garner protests.";;;;"540672916103634945";https://twitter.com/omneyaghanem/status/540672916103634945
teddyluv01;2014-12-04 16:57;0;0;"@BilldeBlasio @CommissBratton was Garner ever given his rights before he was put in a choke hold and taken down and kill by police";;@BilldeBlasio @CommissBratton;;"540671378505334784";https://twitter.com/teddyluv01/status/540671378505334784
lifesjustswell;2014-12-04 16:48;0;0;"#TriBeCa #justnow not just any #rushhour #traffic #protestors for #ferguson and #garner … http:// instagram.com/p/wNJtiel-b0/";;;#TriBeCa #justnow #rushhour #traffic #protestors #ferguson #garner;"540669113505697792";https://twitter.com/lifesjustswell/status/540669113505697792
NewYorkCP;2014-12-04 16:40;0;0;"Police union prez rips de Blasio over Eric Garner : New York’s police union tore into Mayor de Blasio on Thursday,… http:// dlvr.it/7kNnnP";;;;"540666941556273152";https://twitter.com/NewYorkCP/status/540666941556273152
uthmanbaksh;2014-12-04 16:33;0;0;"Like many of you, I too am disappointed in the Eric Garner Grand Jury Decision. But delaying the trains is illegal and will not help you!";;;;"540665261331087360";https://twitter.com/uthmanbaksh/status/540665261331087360
NewYorkCP;2014-12-04 16:23;0;0;"Eric Garner case: what comes next: What happens next after a Staten Island grand jury's decision not to indict… http:// dlvr.it/7kNZMm";;;;"540662743179620353";https://twitter.com/NewYorkCP/status/540662743179620353
HARDHITTINHARRY;2014-12-04 16:18;0;0;"If Eric Garner 's death was never recorded would we even know about it? #justiceforericgarner … http:// instagram.com/p/wNGSBas7ZL/";;;#justiceforericgarner;"540661570947526656";https://twitter.com/HARDHITTINHARRY/status/540661570947526656
dwaynebenji;2014-12-04 16:17;0;0;"Eric Garner 's mom refuses to forgive police officer who killed her son. Forgive him, forgiveness is where healing starts. #EricGarner";;;#EricGarner;"540661159184334850";https://twitter.com/dwaynebenji/status/540661159184334850
evanmcmurry;2014-12-04 16:11;0;0;"OH at Eric Garner rally: "I'm meeting someone in SoHo at 8." #icantbreathe";;;#icantbreathe;"540659683150004225";https://twitter.com/evanmcmurry/status/540659683150004225
oliviataussig;2014-12-04 16:08;0;0;"garner protest pushing through Chinatown and soho, drivers of stranded cars smiling at us and honking along to protest songs #EricGarner";;;#EricGarner;"540658852929499136";https://twitter.com/oliviataussig/status/540658852929499136
Jennbenn06;2014-12-04 16:07;0;1;"“ @BuzzFeed : Jon Stewart Got Serious While Discussing Eric Garner http:// bzfd.it/1tLqYI7 ” #ICantBreathe";;@BuzzFeed;#ICantBreathe;"540658559013625856";https://twitter.com/Jennbenn06/status/540658559013625856
calengerich;2014-12-04 16:02;0;0;"I have to believe in something greater when I get the first video of my niece at the same moment I hear my first Eric Garner protest cries.";;;;"540657495593975808";https://twitter.com/calengerich/status/540657495593975808
mattmikaelian;2014-12-04 15:58;0;0;""Eric Garner ! Michael Brown! Shut the Whole System Down!" #ThisStopsToday pic.twitter.com/CmM3wx7YGP";;;#ThisStopsToday;"540656375769350145";https://twitter.com/mattmikaelian/status/540656375769350145
kat_toth;2014-12-04 15:52;0;0;"Foley Square rally for Eric Garner marching twd Brooklyn Bridge. Yells one: "They are fucking lynching Black people." pic.twitter.com/DOGp9OgPhL";;;;"540654998603194368";https://twitter.com/kat_toth/status/540654998603194368
RockSteadyBee_;2014-12-04 15:30;1;0;"Lol yo so the grand jury indicted the man who recorded garner getting choked out...";;;;"540649383256399872";https://twitter.com/RockSteadyBee_/status/540649383256399872
barrypwp;2014-12-04 15:22;0;0;"Garner verdict protest (@Foley Square in New York, NY w/ @catpeculiar @ericcbailey ) https://www. swarmapp.com/c/3ntR2cR7O9v";;@Foley @catpeculiar @ericcbailey;;"540647433383202817";https://twitter.com/barrypwp/status/540647433383202817
dylanthegypsy;2014-12-04 15:20;0;0;"“ @accessforbidden : gofundme for esaw garner : http:// gofundme.com/i8ytdk ”";;@accessforbidden;;"540646768606982144";https://twitter.com/dylanthegypsy/status/540646768606982144
revjvaz;2014-12-04 15:19;0;1;""Justice for Eric Garner " - shouts the crowd #blacklivesmatter pic.twitter.com/GAOZZYDRrF";;;#blacklivesmatter;"540646626839502848";https://twitter.com/revjvaz/status/540646626839502848
dylanthegypsy;2014-12-04 15:18;0;1;"We live in a country where Darren Wilson is rewarded $1 million for killing a teen over Esaw Garner (Eric Garner 's wife) who lost a husband.";;;;"540646386472321024";https://twitter.com/dylanthegypsy/status/540646386472321024
elianaranjo;2014-12-04 15:10;0;0;"Great email from NYU's President regarding the Brown and Garner jury decisions. #PerstareEtPraestare pic.twitter.com/YNpB3DYjI2";;;#PerstareEtPraestare;"540644435256946688";https://twitter.com/elianaranjo/status/540644435256946688
SteveHalton;2014-12-04 15:09;0;2;"I'm the middle of the Eric Garner protests tonight. #videographer #news pic.twitter.com/25nKmGr79Z";;;#videographer #news;"540644109833474049";https://twitter.com/SteveHalton/status/540644109833474049
pbump;2014-12-04 15:02;92;51;"Spike Lee mixed the Garner footage with the (eerily similar) death of Radio Raheem in Do the Right Thing. http:// j.mp/1FV8xIH";;;;"540642436184154112";https://twitter.com/pbump/status/540642436184154112
InaAlfattah;2014-12-04 15:00;0;0;"#EricGarner - very proud of my Queens Reps @repjoecrowley @NydiaVelazquez @GregoryMeeks for stepping up for what is right on Garner";;@repjoecrowley @NydiaVelazquez @GregoryMeeks;#EricGarner;"540641855478976512";https://twitter.com/InaAlfattah/status/540641855478976512
Fresh_Professor;2014-12-04 14:57;0;1;"#BlackLivesMatter #FoleySquare Eric Garner Mike Brown. Shut the whole system down pic.twitter.com/xl8Mci4IFW";;;#BlackLivesMatter #FoleySquare;"540641067952254976";https://twitter.com/Fresh_Professor/status/540641067952254976
mgeorge4NY;2014-12-04 14:54;13;4;"About 25 people are joining hands to remember Eric Garner at spot where he died pic.twitter.com/FQ68SxrBR0";;;;"540640417931591680";https://twitter.com/mgeorge4NY/status/540640417931591680
NewYorkCP;2014-12-04 14:49;0;0;"Bill de Blasio: ‘More Information Would Be Helpful’ From Garner Grand Jury: Protests for Eric Garner . (Daniel… http:// dlvr.it/7kM5jV";;;;"540638944967147522";https://twitter.com/NewYorkCP/status/540638944967147522
dNo718;2014-12-04 14:48;10;11;"Wrote and recorded a song for Eric Garner today. All proceeds will go to his family. https:// andrewpaladino.bandcamp.com/track/song-for -eric-garner … #BlackLivesMatter #EricGarner";;;#BlackLivesMatter #EricGarner;"540638924063141888";https://twitter.com/dNo718/status/540638924063141888
Immelty;2014-12-04 14:45;0;1;"Alex,mother of two chants "Eric garner Mike brown shut it down." #ErciGarner #MichaelBrown @dodywrites @rebeccaugust pic.twitter.com/XzGIyiWN86";;@dodywrites @rebeccaugust;#ErciGarner #MichaelBrown;"540638135080996865";https://twitter.com/Immelty/status/540638135080996865
gillyg08;2014-12-04 14:36;0;0;"And what is the problem with these #lazyassfools in Staten Island why they not protesting. Garner was killed under their noses. #damnidiots";;;#lazyassfools #damnidiots;"540635774753210369";https://twitter.com/gillyg08/status/540635774753210369
fakerapper;2014-12-04 14:23;19;9;"“ @TPM : white couple interrupted a NYC newscast to mock the chokehold that killed Eric Garner http:// bit.ly/1CK2bxu pic.twitter.com/ltAiUFslSz ”";;@TPM;;"540632492362182656";https://twitter.com/fakerapper/status/540632492362182656
liontamer1183;2014-12-04 14:20;0;0;"Word they on the ave too! #Protest / Garner #Jamaica @Jamaica Center – Parsons/Archer Ave's http:// instagram.com/p/wM4u21rHKY/";;@Jamaica;#Protest #Jamaica;"540631775144603650";https://twitter.com/liontamer1183/status/540631775144603650
gokategoxo;2014-12-04 14:01;0;0;"PROTESTS FOR ERIC GARNER START AT SARA D ROOSEVELT PARK ON HOUSTON BTWN CHRYSTIE AND FORSYTH JZ 456 BD NR TRAINS";;;;"540627013267390464";https://twitter.com/gokategoxo/status/540627013267390464
flyMai;2014-12-04 13:56;0;0;""Hell No !"-Mrs Esaw Garner widow of #EricGarner #PoliceAccountability #ThisStopsToday #ICantBreathe #ServeAndProtect http:// youtu.be/AvrRsO-eU0s";;;#EricGarner #PoliceAccountability #ThisStopsToday #ICantBreathe #ServeAndProtect;"540625754196029440";https://twitter.com/flyMai/status/540625754196029440
ketchadesign;2014-12-04 13:55;0;0;"@cher Cher I live in NY -the Eric Garner case has lots of protests & I feel like joining in";;@cher;;"540625468953997312";https://twitter.com/ketchadesign/status/540625468953997312
smgingin;2014-12-04 13:50;2;0;"Jon Stewart Gets Serious on the Eric Garner Decision: “I Honestly Don’t Know What to Say” http://www. slate.com/blogs/browbeat /2014/12/04/jon_stewart_on_eric_garner_the_daily_show_got_serious_on_the_grand_jury.html?wpsrc …";;;;"540624259325120512";https://twitter.com/smgingin/status/540624259325120512
jwaffless;2014-12-04 13:49;0;1;"“ @ClickHole : Freaky Coincidence! Michael Brown And Eric Garner Were Both Black http://www. clickhole.com/r/1545tsd pic.twitter.com/vuEFsLR9Ll ” omg";;@ClickHole;;"540623908886806528";https://twitter.com/jwaffless/status/540623908886806528
NewYorkCP;2014-12-04 13:44;0;0;"NYPD Outlines Force Retraining as Details Emerge in Garner Decision: As new details emerge surrounding a Staten… http:// dlvr.it/7kL4Q9";;;;"540622745571041281";https://twitter.com/NewYorkCP/status/540622745571041281
NewYorkCP;2014-12-04 13:44;0;0;"Judge grants request to reveal some Eric Garner evidence: A judge Thursday granted the Staten Island DA’s request… http:// dlvr.it/7kL6qL";;;;"540622732832931840";https://twitter.com/NewYorkCP/status/540622732832931840
Alexups804;2014-12-04 13:32;0;1;"Columbia University students protesting for Eric Garner in peace @168th Street http:// instagram.com/p/wMzKJ2Q9zn/";;@168th;;"540619629484572672";https://twitter.com/Alexups804/status/540619629484572672
Alexups804;2014-12-04 13:27;0;0;"@billritter7 Columbia University students protesting for Eric Garner pic.twitter.com/302VfIlu34";;@billritter7;;"540618465217110016";https://twitter.com/Alexups804/status/540618465217110016
Alexups804;2014-12-04 13:23;0;0;"@kemrichardson7 Columbia University students protesting for Eric garner pic.twitter.com/e23sm5xtYd";;@kemrichardson7;;"540617517300219904";https://twitter.com/Alexups804/status/540617517300219904
Alexups804;2014-12-04 13:22;3;2;"@MattKozarTV Columbia University students protesting for Eric garner pic.twitter.com/2n9G1Y28WB";;@MattKozarTV;;"540617102747779073";https://twitter.com/Alexups804/status/540617102747779073
