username;date;retweets;favorites;text;geo;mentions;hashtags;id;permalink
NewYorkCP;2014-12-03 21:49;1;0;"Sharpton Vows March on D.C. Over Eric Garner and Other Police Killings: Rev. Al Sharpton, center, said a national… http:// dlvr.it/7jxC4b";;;;"540382250068492289";https://twitter.com/NewYorkCP/status/540382250068492289
ketchadesign;2014-12-03 21:41;0;0;"@cher Cher what do you think about the Eric Garner decision? I live in NY & I feel like joining in the protesting , outside my building";;@cher;;"540380402528313344";https://twitter.com/ketchadesign/status/540380402528313344
_greghunter;2014-12-03 21:37;1;3;"If you still think the Mike Brown and the Eric Garner cases are about white vs black, go to bed.";;;;"540379462903554048";https://twitter.com/_greghunter/status/540379462903554048
MellifluousP;2014-12-03 21:37;0;1;"If the Eric Garner ruling does not make you terribly ashamed to live in this country, I implore you to check your humanity, and do better.";;;;"540379222146301952";https://twitter.com/MellifluousP/status/540379222146301952
NewYorkCP;2014-12-03 21:33;0;0;"Tompkinsville Residents Angered by Garner Grand Jury Decision, but Protest Peacefully: Residents on the Bay Street… http:// dlvr.it/7jx0Xn";;;;"540378349655187456";https://twitter.com/NewYorkCP/status/540378349655187456
kerriet11;2014-12-03 21:30;1;0;"Protesters Swarm West Side Highway After Garner Decision«CBS http:// cbsloc.al/1vP49Gv shit it down for 2 hrs #HumanBeing #Justice4EricGarner";;;#HumanBeing #Justice4EricGarner;"540377661101842432";https://twitter.com/kerriet11/status/540377661101842432
evanseacucumber;2014-12-03 21:22;0;1;"When I heard the Garner decision pic.twitter.com/wiK6XL7qYi";;;;"540375468168728576";https://twitter.com/evanseacucumber/status/540375468168728576
thelivelyrachel;2014-12-03 21:15;0;1;""A medical examiner ruled Garner 's death homicide in part resulting from the chokehold, a restraining move banned by the NYPD in 1993."";;;;"540373923368812544";https://twitter.com/thelivelyrachel/status/540373923368812544
thetomzone;2014-12-03 21:15;8;4;"Eric Garner 's last words. Awful. Hard to read. Necessary to read. #CantBreathe pic.twitter.com/mrmMHR2XxA";;;#CantBreathe;"540373721207570432";https://twitter.com/thetomzone/status/540373721207570432
hanenPHILLIPINE;2014-12-03 21:13;0;3;"1. The murder of Eric Garner was caught on camera , the officer was not indicted.";;;;"540373244956901377";https://twitter.com/hanenPHILLIPINE/status/540373244956901377
KevinARobinson1;2014-12-03 21:11;1;0;"Eric Garner Protest In #nyc #ericgarner #icantbreath #nypd @nyc http:// instagram.com/p/wLC-2ig9r1/";;@nyc;#nyc #ericgarner #icantbreath #nypd;"540372839711653888";https://twitter.com/KevinARobinson1/status/540372839711653888
Nk3play2;2014-12-03 21:08;1;0;"" @femmeminem : Why do Eric Garner 's dying words so accurately reflect the daily lives of black Americans? pic.twitter.com/5hA9aCdMUQ "";;@femmeminem;;"540372048808513536";https://twitter.com/Nk3play2/status/540372048808513536
gus_no_fear;2014-12-03 20:58;0;0;"A Search for Justice in the Eric Garner Case http:// mobile.nytimes.com/2014/12/04/opi nion/new-inquiry-needed-on-eric-garners-death.html?referrer=&_r=0 …";;;;"540369589293826049";https://twitter.com/gus_no_fear/status/540369589293826049
LatinTrends1;2014-12-03 20:54;0;0;"Despite video, illegal chokehold & Medical Examiner's report the Grand Jury declines to indict NYPD Officer Pantaleo in Eric Garner 's death.";;;;"540368558153555969";https://twitter.com/LatinTrends1/status/540368558153555969
kathykattenburg;2014-12-03 20:51;0;0;"RT @Commentary : The Tragic, Unsettling Death of Eric Garner - by @Commentary - http:// goo.gl/to6tlO";;@Commentary @Commentary;;"540367859059539968";https://twitter.com/kathykattenburg/status/540367859059539968
mirmanwar;2014-12-03 20:47;1;2;"One of the most tragically powerful things I've ever read. RT “ @johngreen : Eric Garner 's last words. pic.twitter.com/3CT7awl3L6 ”";;@johngreen;;"540366804913512449";https://twitter.com/mirmanwar/status/540366804913512449
ErinSchrode;2014-12-03 20:40;8;7;"We're in the street: Grand Central to Times Sq to downtown. Eric Garner , Michael Brown #ShutItDown ! #BlackLivesMatter pic.twitter.com/JAi6j5yfdx";;;#ShutItDown #BlackLivesMatter;"540364901840330753";https://twitter.com/ErinSchrode/status/540364901840330753
asherly;2014-12-03 20:34;0;1;"Eric Garner , Rest in Power.";;;;"540363547289853953";https://twitter.com/asherly/status/540363547289853953
MaryEmilyOHara;2014-12-03 20:31;15;3;"A Grand Jury Did Indict One Person Involved In Eric Garner 's Killing -- The Man Who Filmed It http://www. huffingtonpost.com/2014/12/03/ram sey-orta-indictment-eric-garner_n_6264746.html … via @HuffPostCrime";;@HuffPostCrime;;"540362763034701825";https://twitter.com/MaryEmilyOHara/status/540362763034701825
511NY;2014-12-03 20:30;0;0;"Bus: due to Police activity, both directions M11, M60, M100, M101 and BX15 buses area of Mnhttn (Mnhttn) due to Garner Grand Jury Verdi...";;;;"540362375854301184";https://twitter.com/511NY/status/540362375854301184
ant_ferrara97;2014-12-03 20:21;0;2;"the ferguson case, there are two sides that each make valid points. This Eric Garner case does not. It was murder.";;;;"540360310872625154";https://twitter.com/ant_ferrara97/status/540360310872625154
Praisethyart_;2014-12-03 20:15;1;1;"How the fuck do people not give a shit about the Eric Garner , Mike Brown and Trayvon Martin case...how can be such a ignorant piece of shit?";;;;"540358587034640385";https://twitter.com/Praisethyart_/status/540358587034640385
NewYorkCP;2014-12-03 20:14;0;0;"Protesters Take to Streets After Grand Jury Decides Not to Indict Officer in Garner Case: Police say approximately… http:// dlvr.it/7jvj4q";;;;"540358358658584576";https://twitter.com/NewYorkCP/status/540358358658584576
NewYorkCP;2014-12-03 20:14;0;0;"Eric Garner 's widow doesn't want cop's condolences: The widow of Eric Garner , Esaw Garner , and several of their… http:// dlvr.it/7jvp8Q";;;;"540358356259446784";https://twitter.com/NewYorkCP/status/540358356259446784
NewYorkCP;2014-12-03 20:14;0;0;"Pocket of Staten Island Protesters Attack ‘Sham’ Eric Garner Decision: A solitary protester outside of Richmond… http:// dlvr.it/7jvp5G";;;;"540358354523021314";https://twitter.com/NewYorkCP/status/540358354523021314
NewYorkCP;2014-12-03 20:14;0;0;"‘Hell, No’ Garner ’s Widow Won’t Accept Un-indicted Cop’s Condolences: Esaw Garner , center, unequivocally rejected… http:// dlvr.it/7jvp1r";;;;"540358352635580416";https://twitter.com/NewYorkCP/status/540358352635580416
Fresh_Professor;2014-12-03 20:12;0;0;"Rand Paul says Garner 's death is partly result of politics and taxes. #cantbelieveiagree http:// m.huffpost.com/us/entry/62659 60?ncid=tweetlnkushpmg00000067 …";;;#cantbelieveiagree;"540357966822916096";https://twitter.com/Fresh_Professor/status/540357966822916096
JessiDeeee;2014-12-03 20:11;0;0;"tbh ferguson protest was a lil much tonight but i completely understand what people were doing for garner";;;;"540357748568096768";https://twitter.com/JessiDeeee/status/540357748568096768
readyrock;2014-12-03 20:10;0;0;"To see people of all races passionately protest for Eric garner and shout "black lives matter" i admit, makes my eyes watery #EricGarner";;;#EricGarner;"540357462197817344";https://twitter.com/readyrock/status/540357462197817344
IamGoldie22;2014-12-03 20:05;0;0;"My sentiments exactly regarding Eric Garner . And that was a perfect segue. #DailyShow";;;#DailyShow;"540356233082191873";https://twitter.com/IamGoldie22/status/540356233082191873
510eyes;2014-12-03 20:04;0;0;"#wpix Rip Eric Garner . When will Stop";;;#wpix;"540355908422103042";https://twitter.com/510eyes/status/540355908422103042
Y_iOUWTA;2014-12-03 20:03;3;2;"Now imagine how they would've twisted Eric Garner 's reaction to police intervention if his entire arrest hadn't been filmed.";;;;"540355576774279168";https://twitter.com/Y_iOUWTA/status/540355576774279168
xo_Jennaa;2014-12-03 20:00;0;0;"I don't agree with what happened to Eric Garner at all but cmon now ... it's 2014. protesting isn't going to help anything.";;;;"540354992922976257";https://twitter.com/xo_Jennaa/status/540354992922976257
AllyPrada;2014-12-03 19:57;0;2;"The Garner Protest @42st Times Square http:// instagram.com/p/wK6dratI1q/";;@42st;;"540354108889108480";https://twitter.com/AllyPrada/status/540354108889108480
nyctaxicabtales;2014-12-03 19:47;1;5;"Tonight American people are on demonstration for wrongful killing of Michael Brown and Eric Garner ,W/so many police NYC resembles war zone.";;;;"540351646212325376";https://twitter.com/nyctaxicabtales/status/540351646212325376
MikeVanriel2;2014-12-03 19:42;2;0;"Let me get this straight! The guy who filmed Eric Garner 's death will be indicted by the Grand Jury but the Cop who killed Garner won't?";;;;"540350489393889280";https://twitter.com/MikeVanriel2/status/540350489393889280
mcrf94;2014-12-03 19:41;0;0;"@seanhannity NYC Mayor calls cops who work for him "racist" for following instructions to enforce a stupid law he supported. #Caring #Garner";;@seanhannity;#Caring #Garner;"540350220492886016";https://twitter.com/mcrf94/status/540350220492886016
JessiDeeee;2014-12-03 19:41;0;0;"@daniel_folkner have you even seen the garner trial?? death is not the answer";;@daniel_folkner;;"540350186682585088";https://twitter.com/JessiDeeee/status/540350186682585088
HugoKijne;2014-12-03 19:39;0;0;"The only difference between Dan Donovan and Bob McCulloch is that McCulloch looks like a crook and Donovan does not #Garner #Brown";;;#Garner #Brown;"540349720175312896";https://twitter.com/HugoKijne/status/540349720175312896
GTPexos;2014-12-03 19:37;0;0;"This shit makes me sick man “ @johngreen : Eric Garner 's last words. pic.twitter.com/HuAPxF2zkC ”";;@johngreen;;"540349094850748417";https://twitter.com/GTPexos/status/540349094850748417
luyaozers;2014-12-03 19:37;0;0;"Broadway traffic due to the Eric Garner protest in Times Square #ICantBreathe #ShutItDown #protest … http:// instagram.com/p/wK4Kx7usTv/";;;#ICantBreathe #ShutItDown #protest;"540349060860108800";https://twitter.com/luyaozers/status/540349060860108800
Snappleyard;2014-12-03 19:34;0;2;"Also please tell me how selling individual cigarettes justifies being killed, Eric Garner was not a threat to anyone";;;;"540348330048778241";https://twitter.com/Snappleyard/status/540348330048778241
melarakelvin;2014-12-03 19:24;1;2;"Its sad that Michael Vick's dogs got more justice than Travon Martin, Mike Brown and Eric Garner put together";;;;"540345846379053056";https://twitter.com/melarakelvin/status/540345846379053056
saxjazzman770;2014-12-03 19:14;0;0;"@AC360 : want the #NYPD know how enraged we are #Garner protest NOBODY DESERVES TO DIE NOT BROWN OR GARNER NEED TO CARE ABOUT LIFE.ALL LIFE";;@AC360;#NYPD #Garner;"540343469529899008";https://twitter.com/saxjazzman770/status/540343469529899008
IrIsHfLoBoY;2014-12-03 19:13;0;0;"This ferguson and garner stuff is actually kind of funny";;;;"540343183709073408";https://twitter.com/IrIsHfLoBoY/status/540343183709073408
Leonisintensity;2014-12-03 19:07;0;0;"“ @HuffingtonPost : #CrimingWhileWhite explodes on Twitter following Eric Garner decision http:// huff.to/1vNUMrQ ”";;@HuffingtonPost;#CrimingWhileWhite;"540341588594270208";https://twitter.com/Leonisintensity/status/540341588594270208
tbhsoph;2014-12-03 19:05;0;1;"that video of eric garner is so heartbreaking";;;;"540341202798018560";https://twitter.com/tbhsoph/status/540341202798018560
evanmcmurry;2014-12-03 19:03;1;0;"Judging from my mentions, a nasty subsection of Twitter is really committed to this "Eric Garner died because of a cigarette tax" thing.";;;;"540340690233094145";https://twitter.com/evanmcmurry/status/540340690233094145
thevanessaangel;2014-12-03 19:02;0;1;"The only person that was arrested in the death of Eric Garner was the man who recorded the incident.… http:// instagram.com/p/wK0M6iJiIn/";;;;"540340338247102464";https://twitter.com/thevanessaangel/status/540340338247102464
osytweets;2014-12-03 18:59;0;0;"So horrible and tragic #BlackLivesMatter “ @MarkDuplass : Transcription of Eric Garner 's last words. pic.twitter.com/gKnYtsmMqy ”";;@MarkDuplass;#BlackLivesMatter;"540339505447059457";https://twitter.com/osytweets/status/540339505447059457
Coronakeith;2014-12-03 18:58;0;1;"@my2k @Milmore he made a logical point that there is no causal connection between shutting it down and the Garner incident";;@my2k @Milmore;;"540339297053069312";https://twitter.com/Coronakeith/status/540339297053069312
yunghummusgod;2014-12-03 18:53;0;0;"“ @johngreen : Eric Garner 's last words. pic.twitter.com/3nssaxVOF4 ”";;@johngreen;;"540337964069699584";https://twitter.com/yunghummusgod/status/540337964069699584
tiredboredblog;2014-12-03 18:51;0;1;"NYT Editorial Board on Garner . http:// mobile.nytimes.com/2014/12/04/opi nion/new-inquiry-needed-on-eric-garners-death.html?referrer=&_r=1&referrer= …";;;;"540337605096013824";https://twitter.com/tiredboredblog/status/540337605096013824
larrydaggett;2014-12-03 18:49;0;0;"Kind of ironic that the ESB is illuminated white. No justice for Eric Garner , under the grip of a… http:// instagram.com/p/wKyv1XA0H5/";;;;"540337140240900096";https://twitter.com/larrydaggett/status/540337140240900096
CHICAPOW;2014-12-03 18:49;1;0;"No indictment for the Garner case? You've got to be kidding me.";;;;"540337069739212800";https://twitter.com/CHICAPOW/status/540337069739212800
carolyn_strum;2014-12-03 18:49;0;3;"Brings me to tears. Just heartbreaking. " @ellhah : Let this be the picture of Eric Garner that circulates tonight. pic.twitter.com/sGfbShleNx ”";;@ellhah;;"540337030086266880";https://twitter.com/carolyn_strum/status/540337030086266880
a_GoodPlace;2014-12-03 18:48;0;1;"Protests After Grand Jury in Eric Garner Chokehold Case Doesn’t Indict Officer http:// nyti.ms/1CFYn0i #NoJusticeForEricGarner";;;#NoJusticeForEricGarner;"540336873076715520";https://twitter.com/a_GoodPlace/status/540336873076715520
willalatriste;2014-12-03 18:48;2;0;"Students watch NYPD Police boat accompany the ferry out to Staten Island in wake of Eric Garner grand jury decision pic.twitter.com/kf7RSTVI3n";;;;"540336694403563521";https://twitter.com/willalatriste/status/540336694403563521
CTManinNYC;2014-12-03 18:46;0;0;"Harlem protests outside my window being followed by a #police barrage...crazy #garner #harlem #nyc … http:// instagram.com/p/wKyZU6hOpk/";;;#police #garner #harlem #nyc;"540336366157332480";https://twitter.com/CTManinNYC/status/540336366157332480
thetomzone;2014-12-03 18:44;0;0;"Protesters chanting "NYPD! How do you spell racist?" And "Shut the whole system down! Eric Garner , Michael Brown!" pic.twitter.com/cJBOUvP9hH";;;;"540335691604180992";https://twitter.com/thetomzone/status/540335691604180992
coppfra;2014-12-03 18:43;0;1;"Eric Garner 's last words. pic.twitter.com/XoY4ns0H1t";;;;"540335623580958720";https://twitter.com/coppfra/status/540335623580958720
BrigitteDusseau;2014-12-03 18:39;4;1;"Sur la 3e ave à NY : manifestants au milieu des voitures, la police surveille mais n'intervient pas. #Garner . #AFP pic.twitter.com/RXRQ7cu9lw";;;#Garner #AFP;"540334655892107264";https://twitter.com/BrigitteDusseau/status/540334655892107264
NewYorkCP;2014-12-03 18:39;0;0;"U.S. Justice Dept. to probe Eric Garner 's death: The Justice Department will conduct a federal investigation into… http:// dlvr.it/7jtPlR";;;;"540334469220007937";https://twitter.com/NewYorkCP/status/540334469220007937
Ricar_f;2014-12-03 18:38;0;0;"“ @NYScanner : Manhattan: West 44 St & 8 Ave large protest in Times Square following decision in the death of Eric Garner .” @joellehaddad";;@NYScanner @joellehaddad;;"540334255734534144";https://twitter.com/Ricar_f/status/540334255734534144
RKMCPHERSON2014;2014-12-03 18:36;0;0;"I was just asking @BarackObama The same question@billmaher what's the purpose of the body camera? Cameras didn't indict in the Garner case";;@BarackObama @billmaher;;"540333850736721920";https://twitter.com/RKMCPHERSON2014/status/540333850736721920
ignitecourage;2014-12-03 18:33;0;1;"NYC patriot protests grow in No indictment in Eric Garner death. #takingittothestreetspeacefully";;;#takingittothestreetspeacefully;"540333117635325952";https://twitter.com/ignitecourage/status/540333117635325952
prancingpapio;2014-12-03 18:30;0;0;"F U King RT @stevesilberman Peter King takes fat shaming to a new level by blaming Garner 's death on his "obesity" http:// bit.ly/12wEEjD";;@stevesilberman;;"540332222096883712";https://twitter.com/prancingpapio/status/540332222096883712
UandSNYC;2014-12-03 18:28;2;2;"We can choke too. West Side Highway still crippled. RIP Eric Garner #justiceforEricGarner pic.twitter.com/vk8uYSf7bS";;;#justiceforEricGarner;"540331879191560192";https://twitter.com/UandSNYC/status/540331879191560192
thetomzone;2014-12-03 18:27;0;0;"Cops informing people that everyone on the onramp will be arrested at the Eric Garner protest. pic.twitter.com/d5WAGyLYw0";;;;"540331516950491136";https://twitter.com/thetomzone/status/540331516950491136
EugeniaFinizio;2014-12-03 18:25;0;0;"Protesters near Rockefeller Center after Eric Garner grand jury decision. pic.twitter.com/sg18ntMhKc";;;;"540331149047123970";https://twitter.com/EugeniaFinizio/status/540331149047123970
HugoKijne;2014-12-03 18:13;0;0;"Actually, all those cops who were involved in Eric Garner 's killing should immediately be fired.";;;;"540328024051552256";https://twitter.com/HugoKijne/status/540328024051552256
Arnold_Mok;2014-12-03 18:13;0;0;"#TheKellyFile on #FOXnews . Hello, I'm so confused with this banner. You're talking " Garner ", eh? He's a policeman? pic.twitter.com/OqRdl808lb";;;#TheKellyFile #FOXnews;"540327976295219202";https://twitter.com/Arnold_Mok/status/540327976295219202
malcolmluck;2014-12-03 18:12;0;12;"the Eric Garner case is like the 4th layer of icing on a 7 layer cake";;;;"540327691929800704";https://twitter.com/malcolmluck/status/540327691929800704
JADALAREIGN;2014-12-03 18:09;0;1;"Eric Garner , Michael Brown, shut it down, shut it down!";;;;"540327047164612608";https://twitter.com/JADALAREIGN/status/540327047164612608
dleonardguy;2014-12-03 18:09;0;0;"Eric Garner protests swarming the Rock Center tree lighting right now. @Rockefeller Center http:// instagram.com/p/wKuJuSP5_h/";;@Rockefeller;;"540327034573324288";https://twitter.com/dleonardguy/status/540327034573324288
YankeeMan1973;2014-12-03 18:05;1;2;"" @Timcast : Today a grand jury decided that the killing of Eric Garner was not a crime." Wow! What a surprise! #Sarcasm #Disgrace #Pathetic";;@Timcast;#Sarcasm #Disgrace #Pathetic;"540326049205481473";https://twitter.com/YankeeMan1973/status/540326049205481473
KobaneTheMC;2014-12-03 18:04;0;0;"Watch: Spike Lee Called the Eric Garner Decision (and Protests) Hours Before It Happened http:// cmplx.it/3uHR4 via @ComplexPop";;@ComplexPop;;"540325725250002944";https://twitter.com/KobaneTheMC/status/540325725250002944
G718CHO_;2014-12-03 18:04;0;0;"Smh“ @ComplexMag : Breaking: NYPD officer who choked Eric Garner to death will not be indicted. http:// trib.al/hiyXc6w pic.twitter.com/4SMpJ7gUHr ”";;@ComplexMag;;"540325617024397313";https://twitter.com/G718CHO_/status/540325617024397313
PeroozNews;2014-12-03 17:54;2;0;"Massive protest happening right now in Harlem over lack of indictment in Eric Garner case. #EricGarner #protest";;;#EricGarner #protest;"540323245418119168";https://twitter.com/PeroozNews/status/540323245418119168
evanmcmurry;2014-12-03 17:54;2;1;""ERIC GARNER MICHAEL BROWN SHUT IT DOWN SHUT IT DOWN!" #icantbreathe pic.twitter.com/MNJXdq28FC";;;#icantbreathe;"540323101675102208";https://twitter.com/evanmcmurry/status/540323101675102208
caution_mike;2014-12-03 17:47;0;0;"New Inquiry Needed on Eric Garner ’s Death http:// nyti.ms/1CGMYgN";;;;"540321404672303104";https://twitter.com/caution_mike/status/540321404672303104
KlasfeldReports;2014-12-03 17:43;0;1;"Confrontation brewing at barricade. Chants of "Eric Garner " and "I can't breathe"";;;;"540320478142156800";https://twitter.com/KlasfeldReports/status/540320478142156800
Alsow;2014-12-03 17:42;0;0;"Cameras r not the solution. Eric Garner 's killing was filmed! A special prosecutor is necessary 4 such cases to avoid conflict of interest.";;;;"540320155122028544";https://twitter.com/Alsow/status/540320155122028544
ronhaviv;2014-12-03 17:40;12;7;"New Yorkers of all kinds protest the lack of an indictment in the death of Eric Garner by a NYC… http:// instagram.com/p/wKqzYuoht9/";;;;"540319672609300480";https://twitter.com/ronhaviv/status/540319672609300480
hammertime1009;2014-12-03 17:39;0;0;"Ferguson/ garner protest in Harlem real. Life is crazy.";;;;"540319437849911300";https://twitter.com/hammertime1009/status/540319437849911300
TimEBrutus;2014-12-03 17:37;2;1;"@HTheCam @grasswire The NYPD kills Garner when violating procedure disallowing choke hold and it caught on video & cop he's off! GTFOHWTRBS";;@HTheCam @grasswire;;"540319003160621056";https://twitter.com/TimEBrutus/status/540319003160621056
vpooch1;2014-12-03 17:35;0;0;"I'm just going to say that in the video it's sure does looking like Mr. Garner is resisting arrest. Come on people.";;;;"540318539237044224";https://twitter.com/vpooch1/status/540318539237044224
jamesgutierrez;2014-12-03 17:33;0;1;"New Inquiry Needed on Eric Garner ’s Death via @nytimes #ICantBreathe http://www. nytimes.com/2014/12/04/opi nion/new-inquiry-needed-on-eric-garners-death.html?smprod=nytcore-iphone&smid=nytcore-iphone-share …";;@nytimes;#ICantBreathe;"540317869628997632";https://twitter.com/jamesgutierrez/status/540317869628997632
mschwirtz;2014-12-03 17:31;6;4;"Rikers Island bus heading in the direction of Eric Garner protests pic.twitter.com/wOW9Jm9628";;;;"540317521912819712";https://twitter.com/mschwirtz/status/540317521912819712
LegendaryLuna;2014-12-03 17:30;0;0;"This is what Eric Garner 's wife and mother said after the grand jury decision http:// 4.nbcny.com/OnpnM0H pic.twitter.com/Wv3XIH2GGV";;;;"540317251828989952";https://twitter.com/LegendaryLuna/status/540317251828989952
poorlilritchie;2014-12-03 17:30;0;0;"R.I.P. Eric Garner https:// m.youtube.com/watch?v=j1ka4o Ku1jo …";;;;"540317074221182976";https://twitter.com/poorlilritchie/status/540317074221182976
mponweb;2014-12-03 17:27;0;0;"NYTimes: No Indictment in Eric Garner Chokehold Case for N.Y.P.D. Officer http:// nyti.ms/1CFYn0i";;;;"540316472883814400";https://twitter.com/mponweb/status/540316472883814400
learmonth;2014-12-03 17:22;0;3;"A lot of poise from Eric Garner 's mother/wife in a terrible situation. Impressive";;;;"540315097932238848";https://twitter.com/learmonth/status/540315097932238848
erinmdurkin;2014-12-03 17:20;6;0;""We want you to rally but rally in peace" - Garner 's mother Gwen Carr";;;;"540314591394529280";https://twitter.com/erinmdurkin/status/540314591394529280
BigMamaC49;2014-12-03 17:18;0;0;"A Grand Jury Did Indict One Person Involved In Eric Garner 's Killing -- The Man Who Filmed It http://www. huffingtonpost.com/2014/12/03/ram sey-orta-indictment-eric-garner_n_6264746.html … via @HuffPostCrime";;@HuffPostCrime;;"540314234757079040";https://twitter.com/BigMamaC49/status/540314234757079040
islamoyankee;2014-12-03 17:17;0;0;""The Lawful Killing Of Eric Garner " good read via @sullydish http:// dish.andrewsullivan.com/2014/12/03/the -lawful-killing-of-eric-garner/ …";;@sullydish;;"540313967722131456";https://twitter.com/islamoyankee/status/540313967722131456
learmonth;2014-12-03 17:12;0;3;"They should have written Eric Garner a summons and walked away";;;;"540312557148704769";https://twitter.com/learmonth/status/540312557148704769
NewYorkCP;2014-12-03 17:05;0;0;"Garner Kin: Anger, Frustration After Grand Jury Decision: Eric Garner 's family say they feel "anger" and… http:// dlvr.it/7jrwTg";;;;"540310792780783616";https://twitter.com/NewYorkCP/status/540310792780783616
chub4bear;2014-12-03 17:04;0;1;"#WeHearYou #NYPD Really? When you did Not hear Eric Garner begging "I can't breathe" numerous times?";;;#WeHearYou #NYPD;"540310647008145408";https://twitter.com/chub4bear/status/540310647008145408
Laura_E_Adkins;2014-12-03 17:02;0;0;"Watch the video of Eric Garner 's death. Read the autopsy report. Don't tell me justice was served here.";;;;"540310235039432704";https://twitter.com/Laura_E_Adkins/status/540310235039432704
melfi;2014-12-03 17:01;0;1;"lot of people marching and protesting outside of Radio City and the tree lighting for Eric Garner @… http:// instagram.com/p/wKmXbZBljG/";;@;;"540309912556171264";https://twitter.com/melfi/status/540309912556171264
Vivcharlap;2014-12-03 16:58;13;18;"Do not forget Ferguson Do not forget Mike Brown Do not forget Eric Garner #NoJusticeNoPeace";;;#NoJusticeNoPeace;"540309246421000192";https://twitter.com/Vivcharlap/status/540309246421000192
missanabeem;2014-12-03 16:56;0;1;""This is what democracy looks like." #EricGarner #Garner #NYC pic.twitter.com/JC2u26fB5j";;;#EricGarner #Garner #NYC;"540308676821917698";https://twitter.com/missanabeem/status/540308676821917698
Sidnicious;2014-12-03 16:54;1;1;"There's a rally for Eric Garner happening right now in NYC: http:// youtu.be/lZ-FeUp8LuQ";;;;"540308065158176768";https://twitter.com/Sidnicious/status/540308065158176768
AnBressBBC;2014-12-03 16:50;0;0;"All the protesters I met in Staten Island say they want justice for #garner but they don't want another #ferguson";;;#garner #ferguson;"540307029316087809";https://twitter.com/AnBressBBC/status/540307029316087809
TeamDreamCEO;2014-12-03 16:49;0;0;"Rip Eric Garner";;;;"540306889285054464";https://twitter.com/TeamDreamCEO/status/540306889285054464
helIozestrokes;2014-12-03 16:46;0;0;"eric garner really was so fucking nice and for breaking up a fight and selling loosies he was murdered. im gonna miss him";;;;"540306037761654784";https://twitter.com/helIozestrokes/status/540306037761654784
